"Story","Title","Result","Date","Stability","Duration (s)"
"Login","Login with valid email and password","SUCCESS","2022-11-08T20:51:10.3634968+07:00[Asia/Bangkok]","0.0","4.78"
"Login","Login with invalid email and password","SUCCESS","2022-11-08T20:51:15.1968083+07:00[Asia/Bangkok]","0.0","1.37"
"Login","Login with null email and password","SUCCESS","2022-11-08T20:51:16.5636288+07:00[Asia/Bangkok]","0.0","1.36"
"Login","Login with valid email and invalid password","SUCCESS","2022-11-08T20:51:17.9229992+07:00[Asia/Bangkok]","0.0","1.44"
"Login","Login with invalid email and valid password","SUCCESS","2022-11-08T20:51:19.3652411+07:00[Asia/Bangkok]","0.0","1.31"
